{
  "$schema": "https://json-schema.org/draft/2020-12/schema",
  "$id": "https://yeongseon.github.io/azure-app-service-practical-guide/schemas/golden/manifest.schema.json",
  "title": "Golden v1 run manifest",
  "description": "Run identity and the assertions declared BEFORE execution. Declaring assertions up front is what stops a run from choosing its own success criteria after seeing the evidence.",
  "type": "object",
  "additionalProperties": false,
  "required": [
    "run_id",
    "resource_id",
    "captured_at",
    "execution_status",
    "assertions"
  ],
  "properties": {
    "run_id": {
      "type": [
        "string",
        "null"
      ],
      "description": "Unique per run. Evidence from one run must never be evaluated against another. Null in a template: a manifest that has not run has no identity to state."
    },
    "resource_id": {
      "type": [
        "string",
        "null"
      ],
      "minLength": 1,
      "description": "Null in a template: a manifest that has not run has no identity to state."
    },
    "captured_at": {
      "type": [
        "string",
        "null"
      ],
      "format": "date-time",
      "description": "When the EVIDENCE was collected. Never overwritten by a later evaluation. Null in a template: a manifest that has not run has no identity to state."
    },
    "evaluated_at": {
      "type": [
        "string",
        "null"
      ],
      "format": "date-time",
      "description": "When the gates were re-derived offline. Distinct from captured_at: re-running an evaluator must not restate old evidence as freshly captured. Null in a template: a manifest that has not run has no identity to state."
    },
    "document_updated_at": {
      "type": [
        "string",
        "null"
      ],
      "oneOf": [
        {"type": "string", "format": "date-time"},
        {"type": "string", "format": "date"},
        {"type": "null"}
      ],
      "description": "When the prose was last edited. Date-only values are an explicit pre-contract historical allowance; new records should use date-time."
    },
    "execution_status": {
      "enum": [
        "COMPLETE",
        "PARTIAL",
        "BLOCKED",
        "FAILED",
        "NOT_RUN"
      ]
    },
    "evidence_trust": {
      "enum": [
        "trusted-current",
        "trusted-historical",
        "unverified",
        "invalid"
      ],
      "default": "trusted-current"
    },
    "assertions": {
      "type": "array",
      "items": {
        "$ref": "https://yeongseon.github.io/azure-app-service-practical-guide/schemas/golden/assertion.schema.json"
      }
    },
    "hypothesis": {
      "type": "string",
      "description": "The claim the declared assertions are meant to test. Stated before execution so a run cannot choose what it was asking after seeing the answer."
    },
    "notes": {
      "type": [
        "string",
        "array"
      ],
      "description": "Author commentary. Carries no weight in evaluation."
    },
    "source_commit": {
      "type": "string",
      "pattern": "^[0-9a-f]{40}$"
    },
    "runner_source_commit": {
      "type": "string",
      "pattern": "^[0-9a-f]{40}$"
    },
    "environment": {
      "type": "object",
      "minProperties": 1
    },
    "recipe_digest": {
      "type": "string",
      "pattern": "^sha256:[0-9a-f]{64}$"
    },
    "collector_digest": {
      "type": "string",
      "pattern": "^sha256:[0-9a-f]{64}$"
    },
    "collector_path": {
      "type": "string",
      "minLength": 1
    },
    "recipe_paths": {
      "type": "array",
      "minItems": 1,
      "uniqueItems": true,
      "items": {
        "type": "string",
        "minLength": 1
      }
    },
    "hypothesis_claim_level": {
      "enum": ["Documented", "Observed", "Inferred", "Not Proven"]
    },
    "capture_window": {
      "type": "object",
      "additionalProperties": false,
      "required": ["started_at", "ended_at"],
      "properties": {
        "started_at": {"type": "string", "format": "date-time"},
        "ended_at": {"type": "string", "format": "date-time"}
      }
    }
  },
  "allOf": [
    {
      "if": {"required": ["hypothesis"]},
      "then": {
        "anyOf": [
          {"required": ["hypothesis_claim_level"]},
          {
            "properties": {
              "resource_id": {"type": "null"},
              "evidence_trust": {"const": "unverified"}
            },
            "required": ["resource_id", "evidence_trust"]
          }
        ]
      }
    },
    {
      "if": {"properties": {"execution_status": {"const": "COMPLETE"}}},
      "then": {
        "anyOf": [
          {
            "required": ["source_commit", "environment", "recipe_digest", "collector_digest"]
          },
          {
            "description": "Explicit pre-contract retained-run allowance. Historical packages with a sanitized null resource and unverified custody remain schema-valid without rewriting their immutable manifests.",
            "properties": {
              "resource_id": {"type": "null"},
              "evidence_trust": {"const": "unverified"}
            },
            "required": ["resource_id", "evidence_trust"]
          }
        ]
      }
    }
  ]
}
