{
  "run_id": null,
  "resource_id": null,
  "captured_at": null,
  "evaluated_at": null,
  "document_updated_at": "2026-09-27",
  "execution_status": "NOT_RUN",
  "hypothesis_claim_level": "Inferred",
  "evidence_trust": "trusted-current",
  "hypothesis": "Outbound connections from the app exhaust the SNAT port allocation of its App Service plan, so new outbound connections to the same destination begin failing at the transport layer while the destination itself stays healthy.",
  "assertions": [
    {
      "id": "baseline-outbound-succeeds",
      "role": "control",
      "field": "baseline_success_count",
      "equals": 3,
      "claim_level": "Observed",
      "note": "Before load, every outbound probe completes. Without this the later failures cannot be attributed to exhaustion rather than a destination that was broken all along. The expected count equals PROBES_PER_PHASE in scripts/golden/run_scenario_b.py; a test asserts the two agree so changing one without the other fails rather than silently contradicting every run."
    },
    {
      "id": "symptom-transport-failures-appear",
      "role": "symptom",
      "field": "load_transport_failure_count",
      "in": [
        1,
        2,
        3
      ],
      "claim_level": "Observed",
      "note": "Connections fail before any HTTP status is returned. A transport failure is the symptom; an HTTP error code is not, because the destination answering 5xx would mean the destination failed rather than the connection."
    },
    {
      "id": "control-destination-bound-to-workload",
      "role": "control",
      "field": "destination_binding",
      "equals": true,
      "claim_level": "Observed",
      "note": "The directly probed destination must be the same destination configured for the app workload."
    },
    {
      "id": "discriminating-snat-port-pressure",
      "role": "discriminating",
      "field": "snat_port_pressure",
      "equals": "observed",
      "claim_level": "Observed",
      "note": "A direct port-pressure observation is required for the causal claim. unavailable or absent telemetry leaves the result INCONCLUSIVE."
    },
    {
      "id": "discriminating-destination-stays-healthy",
      "role": "discriminating",
      "field": "destination_health_status",
      "equals": 200,
      "claim_level": "Observed",
      "note": "This is what separates SNAT exhaustion from destination failure. If the destination is also unhealthy the transport failures are explained without invoking port exhaustion, and the hypothesis is not supported."
    },
    {
      "id": "discriminating-http-errors-absent",
      "role": "discriminating",
      "field": "load_http_error_count",
      "equals": 0,
      "claim_level": "Observed",
      "note": "Exhaustion prevents connections from being established, so failures arrive as transport errors and not as 4xx or 5xx responses. A run showing HTTP errors instead is describing a different fault."
    },
    {
      "id": "discriminating-pooling-reduces-transport-failures",
      "role": "discriminating",
      "field": "pooling_reduces_transport_failures",
      "equals": true,
      "claim_level": "Observed",
      "note": "The pooled path must show fewer transport failures than the unpooled path under the same phase and destination."
    },
    {
      "id": "recovery-outbound-succeeds-again",
      "role": "recovery",
      "field": "recovery_success_count",
      "equals": 3,
      "claim_level": "Observed",
      "note": "After connection pressure is removed, outbound probes succeed again. Without recovery the run cannot distinguish exhaustion from a permanent break introduced during the load phase. The expected count equals PROBES_PER_PHASE in scripts/golden/run_scenario_b.py; a test asserts the two agree so changing one without the other fails rather than silently contradicting every run."
    }
  ],
  "notes": "Scenario B is the comparative scenario: its verdict depends on two probes agreeing about the same response rather than on a single measurement. Both transports classify through labs/snat-exhaustion/app/classification.py so that urllib and requests cannot disagree about an identical response, which was the defect that made an earlier version of this lab self-grading. execution_status is NOT_RUN because this contract has never been executed against Azure; the counts above are the declared success criteria, not observations."
}
